{
  "schemaVersion": "1.0",
  "id": "4886d15d-0cf6-4543-b30a-f203cf263d90",
  "caseId": "24ce9c6a-a4f9-42bf-a7c3-237f3beca38e",
  "provider": "gpt-live",
  "locale": "de",
  "status": "active",
  "createdAt": "2026-10-31T13:49:48.952Z",
  "expiresAt": "2026-10-31T14:19:48.952Z",
  "endedAt": null,
  "closeReason": null,
  "transcriptRevision": 0,
  "turnCount": 0,
  "resumeFrom": null,
  "noticeVersion": "voice-synthetic-v1",
  "dataClassification": "synthetic",
  "externalVoiceProcessingAccepted": true,
  "remoteStop": "not_requested",
  "fullContextTransferAuthorized": false
}
